{
  "schema_kind": "odd_world_model.attribute_ledger_entry",
  "schema_version": "v1",
  "entry_id": "odd_world_model.attribute_ledger.sandbox_banking_product_catalog.banking_product_catalog_001.catalog_id.v1",
  "object_ref": "odd_world_model.markov_object.sandbox_banking_product_catalog.bankingproductcatalog.banking_product_catalog_001",
  "claim_key": "catalog_id",
  "claim_kind": "identity",
  "value": "banking_product_catalog_001",
  "trace_record_refs": [
    "review://traces/banking_product_catalog_001/catalog_id.json"
  ],
  "assurance_record_refs": [
    "review://assurance/banking_product_catalog_001/catalog_id.json"
  ],
  "published_at": "2026-04-20T00:00:00Z"
}
