{
  "schema_kind": "odd_world_model.attribute_ledger_entry",
  "schema_version": "v1",
  "entry_id": "odd_world_model.attribute_ledger.apra_liquidity.reporting_position.apra_liquidity_position_001.counterparty_bucket.v1",
  "object_ref": "odd_world_model.markov_object.apra_liquidity.reporting_position.apra_liquidity_position_001",
  "claim_key": "counterparty_bucket",
  "claim_kind": "classified",
  "value": "odd_world_model.world_model_object.apra_liquidity.counterparty_bucket.financial_institution",
  "trace_record_refs": [
    "review://apra_liquidity/traces/reporting_position/counterparty_bucket/authority_claim.json",
    "review://apra_liquidity/traces/reporting_position/counterparty_bucket/trade_counterparty.json"
  ],
  "assurance_record_refs": [
    "review://apra_liquidity/assurance/reporting_position/counterparty_bucket.json"
  ],
  "published_at": "2026-04-15T00:00:00Z",
  "qualifiers": {
    "bucket_code": "financial_institution",
    "counterparty_name": "Bank",
    "counterparty_id": "549300KFSLY4U7N3LL12"
  },
  "observed_at": "2026-04-15T00:10:00Z",
  "summary": "Counterparty bucket classified from official APRA reporting definitions and retained trade-representation evidence."
}
