{
  "schema_kind": "odd_world_model.attribute_ledger_entry",
  "schema_version": "v1",
  "entry_id": "odd_world_model.attribute_ledger.sandbox_apra_liquidity_reporting.apra_liquidity_position_001.lifecycle_state.v1",
  "object_ref": "odd_world_model.markov_object.sandbox_apra_liquidity_reporting.reportingposition.apra_liquidity_position_001",
  "claim_key": "lifecycle_state",
  "claim_kind": "state",
  "value": "draft_classified",
  "trace_record_refs": [
    "review://traces/apra_liquidity_position_001/lifecycle_state.json"
  ],
  "assurance_record_refs": [
    "review://assurance/apra_liquidity_position_001/lifecycle_state.json"
  ],
  "published_at": "2026-04-20T00:00:00Z"
}
