{
  "schema_kind": "odd_world_model.attribute_ledger_entry",
  "schema_version": "v1",
  "entry_id": "odd_world_model.attribute_ledger.sandbox_trade_representation_capture.trade_sandbox_001.agreement_id.v1",
  "object_ref": "odd_world_model.markov_object.sandbox_trade_representation_capture.trade.trade_sandbox_001",
  "claim_key": "agreement_id",
  "claim_kind": "identity",
  "value": "agreement_sandbox_001",
  "trace_record_refs": [
    "review://traces/trade_sandbox_001/agreement_id.json"
  ],
  "assurance_record_refs": [
    "review://assurance/trade_sandbox_001/agreement_id.json"
  ],
  "published_at": "2026-04-20T00:00:00Z"
}
