{
  "schema_kind": "odd_world_model.attribute_ledger_entry",
  "schema_version": "v1",
  "entry_id": "odd_world_model.attribute_ledger.sandbox_banking_product_catalog.loan_001.product_name.v1",
  "object_ref": "odd_world_model.markov_object.sandbox_banking_product_catalog.loanorcredit.loan_001",
  "claim_key": "product_name",
  "claim_kind": "attribute",
  "value": "Personal Loan",
  "trace_record_refs": [
    "review://traces/loan_001/product_name.json"
  ],
  "assurance_record_refs": [
    "review://assurance/loan_001/product_name.json"
  ],
  "published_at": "2026-04-20T00:00:00Z"
}
