{
  "schema_kind": "odd_world_model.attribute_ledger_entry",
  "schema_version": "v1",
  "entry_id": "odd_world_model.attribute_ledger.sandbox_trade_representation_capture.trade_sandbox_001.product_name.v1",
  "object_ref": "odd_world_model.markov_object.sandbox_trade_representation_capture.trade.trade_sandbox_001",
  "claim_key": "product_name",
  "claim_kind": "attribute",
  "value": "Brent commodity swap",
  "trace_record_refs": [
    "review://traces/trade_sandbox_001/product_name.json"
  ],
  "assurance_record_refs": [
    "review://assurance/trade_sandbox_001/product_name.json"
  ],
  "published_at": "2026-04-20T00:00:00Z"
}
