{
  "schema_kind": "odd_world_model.attribute_ledger_entry",
  "schema_version": "v1",
  "entry_id": "odd_world_model.attribute_ledger.sandbox_banking_product_catalog.mortgage_001.market_segment.v1",
  "object_ref": "odd_world_model.markov_object.sandbox_banking_product_catalog.mortgageloan.mortgage_001",
  "claim_key": "market_segment",
  "claim_kind": "attribute",
  "value": "retail",
  "trace_record_refs": [
    "review://traces/mortgage_001/market_segment.json"
  ],
  "assurance_record_refs": [
    "review://assurance/mortgage_001/market_segment.json"
  ],
  "published_at": "2026-04-20T00:00:00Z"
}
