{
  "schema_kind": "odd_world_model.attribute_ledger_entry",
  "schema_version": "v1",
  "entry_id": "odd_world_model.attribute_ledger.fpml_confirmation_source.trade_record.trade_date.v1",
  "object_ref": "odd_world_model.world_model_object.fpml_confirmation.trade_record.trade_fpml_001",
  "claim_key": "trade_date",
  "claim_kind": "state",
  "value": "2006-06-01",
  "trace_record_refs": [
    "review://traces/source_trade_record/trade_date.json"
  ],
  "assurance_record_refs": [
    "review://assurance/source_trade_record/trade_date.json"
  ],
  "published_at": "2026-04-20T00:00:00Z"
}
