{
  "schema_kind": "odd_world_model.attribute_ledger_entry",
  "schema_version": "v1",
  "entry_id": "odd_world_model.attribute_ledger.apra_liquidity.reporting_position.apra_liquidity_position_001.reporting_lifecycle_state.v1",
  "object_ref": "odd_world_model.markov_object.apra_liquidity.reporting_position.apra_liquidity_position_001",
  "claim_key": "reporting_lifecycle_state",
  "claim_kind": "projected",
  "value": "draft_classified",
  "trace_record_refs": [
    "review://apra_liquidity/traces/reporting_position/reporting_lifecycle_state/domain_input.json"
  ],
  "assurance_record_refs": [
    "review://apra_liquidity/assurance/reporting_position/reporting_lifecycle_state.json"
  ],
  "published_at": "2026-04-15T00:00:00Z",
  "observed_at": "2026-04-15T00:10:00Z",
  "summary": "Lifecycle state projected from the current retained APRA-liquidity domain-build state."
}
